{
  "$schema": "https://json-schema.org/draft/2020-12/schema",
  "title": "SimpleBench plugin v1",
  "type": "object",
  "additionalProperties": false,
  "properties": {
    "schemaVersion": {
      "const": 1
    },
    "hostApi": {
      "const": 1
    },
    "id": {
      "type": "string",
      "minLength": 1,
      "maxLength": 100,
      "pattern": "^[a-z][a-z0-9-]*(\\.[a-z][a-z0-9-]*)+$"
    },
    "name": {
      "type": "string",
      "minLength": 1,
      "maxLength": 160
    },
    "version": {
      "type": "string",
      "maxLength": 80,
      "pattern": "^[0-9]+\\.[0-9]+\\.[0-9]+(-[a-zA-Z0-9.-]+)?$"
    },
    "description": {
      "type": "string",
      "minLength": 1,
      "maxLength": 2000
    },
    "entry": {
      "type": "string",
      "minLength": 1,
      "maxLength": 512,
      "description": "Relative package path. No traversal, backslashes, encoded paths, Windows reserved names, or symlinks."
    },
    "activation": {
      "enum": ["startup", "lazy"]
    },
    "stylesheets": {
      "type": "array",
      "maxItems": 16,
      "uniqueItems": true,
      "items": {
        "type": "string",
        "minLength": 1,
        "maxLength": 512,
        "description": "Relative package path. No traversal, backslashes, encoded paths, Windows reserved names, or symlinks."
      }
    },
    "contributes": {
      "type": "object",
      "additionalProperties": false,
      "properties": {
        "views": {
          "type": "array",
          "maxItems": 128,
          "items": {
            "type": "object",
            "additionalProperties": false,
            "properties": {
              "id": {
                "type": "string",
                "minLength": 1,
                "maxLength": 160,
                "pattern": "^[a-z][a-z0-9-]*(\\.[a-z][a-z0-9-]*)+$"
              },
              "title": {
                "type": "string",
                "minLength": 1,
                "maxLength": 160
              },
              "placement": {
                "enum": ["central", "sidebar"]
              },
              "multiple": {
                "type": "boolean"
              },
              "stateVersion": {
                "type": "integer",
                "minimum": 1,
                "maximum": 1000
              }
            },
            "required": [
              "id",
              "title",
              "placement",
              "multiple",
              "stateVersion"
            ],
            "allOf": [
              {
                "if": {
                  "properties": {
                    "placement": {
                      "const": "sidebar"
                    }
                  }
                },
                "then": {
                  "properties": {
                    "multiple": {
                      "const": false
                    }
                  }
                }
              }
            ]
          }
        },
        "commands": {
          "type": "array",
          "maxItems": 128,
          "items": {
            "type": "object",
            "additionalProperties": false,
            "properties": {
              "id": {
                "type": "string",
                "minLength": 1,
                "maxLength": 160,
                "pattern": "^[a-z][a-z0-9-]*(\\.[a-z][a-z0-9-]*)+$"
              },
              "label": {
                "type": "string",
                "minLength": 1,
                "maxLength": 160
              },
              "description": {
                "type": "string",
                "minLength": 1,
                "maxLength": 2000
              },
              "context": {
                "type": "object",
                "additionalProperties": false,
                "properties": {
                  "workspace": {
                    "type": "boolean"
                  },
                  "textInput": {
                    "type": "boolean"
                  },
                  "viewTypes": {
                    "type": "array",
                    "maxItems": 128,
                    "items": {
                      "type": "string",
                      "minLength": 1,
                      "maxLength": 160
                    }
                  }
                }
              }
            },
            "required": ["id", "label", "description"]
          }
        },
        "keybindings": {
          "type": "array",
          "maxItems": 128,
          "items": {
            "type": "object",
            "additionalProperties": false,
            "properties": {
              "command": {
                "type": "string",
                "minLength": 1,
                "maxLength": 160,
                "pattern": "^[a-z][a-z0-9-]*(\\.[a-z][a-z0-9-]*)+$"
              },
              "shortcut": {
                "type": ["string", "null"]
              }
            },
            "required": ["command", "shortcut"]
          }
        },
        "fills": {
          "type": "array",
          "maxItems": 128,
          "items": {
            "type": "object",
            "additionalProperties": false,
            "properties": {
              "id": {
                "type": "string",
                "minLength": 1,
                "maxLength": 160,
                "pattern": "^[a-z][a-z0-9-]*(\\.[a-z][a-z0-9-]*)+$"
              },
              "slot": {
                "enum": ["statusbar", "sidebar-actions", "view-actions"]
              },
              "label": {
                "type": "string",
                "minLength": 1,
                "maxLength": 160
              }
            },
            "required": ["id", "slot", "label"]
          }
        },
        "themes": {
          "type": "array",
          "maxItems": 128,
          "items": {
            "type": "object",
            "additionalProperties": false,
            "properties": {
              "id": {
                "type": "string",
                "minLength": 1,
                "maxLength": 160,
                "pattern": "^[a-z][a-z0-9-]*(\\.[a-z][a-z0-9-]*)+$"
              },
              "path": {
                "type": "string",
                "minLength": 1,
                "maxLength": 512,
                "description": "Relative package path. No traversal, backslashes, encoded paths, Windows reserved names, or symlinks."
              }
            },
            "required": ["id", "path"]
          }
        }
      }
    }
  },
  "required": [
    "schemaVersion",
    "hostApi",
    "id",
    "name",
    "version",
    "description"
  ]
}
