{
  "schemaVersion": 1,
  "hostApi": 1,
  "id": "test.fault",
  "name": "Partial activation fault",
  "version": "1.0.0",
  "description": "Validation fixture: fails after registering cooperative resources.",
  "entry": "index.js",
  "activation": "lazy",
  "contributes": {
    "commands": [
      {
        "id": "test.fault.run",
        "label": "Trigger activation fault",
        "description": "Test partial cleanup.",
        "context": {}
      }
    ],
    "fills": [
      {
        "id": "test.fault.status",
        "label": "Fault fixture",
        "slot": "statusbar"
      }
    ]
  }
}
